{
  "format": 1,
  "build": {
    "steamBuildId": "25143593",
    "gameVersion": "1.1.21239",
    "name": "1.1.21239 (steam 25143593)",
    "timeDateStamp": "0x6a9c51e5",
    "sizeOfImage": "0x1574000",
    "imageBase": "0x140000000",
    "exeSha256": "4127cd6a792ae528bca6f65a8873dd61789591937d87656c2b586a5e30eb77ea",
    "exeSize": 22019072,
    "sdlVersion": "3.2.12",
    "linked": "2026-09-05",
    "note": "First manifest; converted from bindings/25143593.sig.tsv + native/framework/src/signatures.h + status_engine.c g_lk_rva + mewtest.c OFF_* on 2026-10-19. Offsets are unanchored until the harvest step records witnesses."
  },
  "sigCap": 128,
  "entries": [
    {
      "name": "TurnControl_NextTurn",
      "kind": "function",
      "rva": "0x8e3c60",
      "signature": {
        "pattern": "48 89 4C 24 08 55 53 56 57 41 54 41 55 41 56 41 57 48 8D AC 24 28 EF FF FF B8 D8 11 00 00 E8 ?? ?? ?? ?? 48 2B E0 0F 29 B4 24 C0 11 00 00 48",
        "exactLen": 47,
        "offset": 0,
        "wildcards": [
          {
            "at": 31,
            "len": 4,
            "why": "E8 rel32"
          }
        ]
      },
      "anchors": {
        "strings": [],
        "cfgLite": {
          "bytes": 4474,
          "calls": 93,
          "ripRefs": 43,
          "resyncs": 1
        },
        "callees": [
          {
            "ordinal": 5,
            "name": "string_Allocate",
            "target": "0x52a40"
          },
          {
            "ordinal": 7,
            "name": "Scene_CreateEntity",
            "target": "0x96b3e0"
          },
          {
            "ordinal": 10,
            "name": "string_Allocate",
            "target": "0x52a40"
          },
          {
            "ordinal": 12,
            "name": "Scene_CreateEntity",
            "target": "0x96b3e0"
          },
          {
            "ordinal": 15,
            "name": "string_Allocate",
            "target": "0x52a40"
          },
          {
            "ordinal": 17,
            "name": "Scene_CreateEntity",
            "target": "0x96b3e0"
          },
          {
            "ordinal": 20,
            "name": "string_Allocate",
            "target": "0x52a40"
          },
          {
            "ordinal": 25,
            "name": "string_Allocate",
            "target": "0x52a40"
          },
          {
            "ordinal": 29,
            "name": "Scene_CreateEntity",
            "target": "0x96b3e0"
          },
          {
            "ordinal": 39,
            "name": "string_Allocate",
            "target": "0x52a40"
          },
          {
            "ordinal": 44,
            "name": "string_Allocate",
            "target": "0x52a40"
          },
          {
            "ordinal": 48,
            "name": "Scene_CreateEntity",
            "target": "0x96b3e0"
          },
          {
            "ordinal": 51,
            "name": "string_TidyDeallocate",
            "target": "0x52780"
          }
        ],
        "prologue": "48 89 4C 24 08 55 53 56 57 41 54 41"
      },
      "consumers": [
        "native/framework/src/framework.c:hook_TurnControl_NextTurn",
        "native/mods/test-harness/src/mewtest.c:hook_NextTurn"
      ],
      "exposure": [
        {
          "enum": "FW_SYM_TurnControl_NextTurn",
          "index": 0
        }
      ],
      "evidence": [
        "docs/engine-map.md#functions-and-signatures"
      ],
      "verify": {
        "log": "hook installed: TurnControl::NextTurn"
      }
    },
    {
      "name": "Character_BeginTurn",
      "kind": "function",
      "rva": "0x10a9b0",
      "signature": {
        "pattern": "48 89 5C 24 08 89 54 24 10 55 56 57 41 54 41 55 41 56 41 57 48 8D",
        "exactLen": 22,
        "offset": 0,
        "wildcards": []
      },
      "anchors": {
        "strings": [
          {
            "text": "C:\\Users\\Tyler\\Desktop\\SVN\\Mewgenics\\game\\code\\Character.cpp",
            "role": "file",
            "unique": true
          },
          {
            "text": "void __cdecl glaiel::Character::BeginTurn(enum glaiel::TurnKind)",
            "role": "funcsig",
            "unique": true
          }
        ],
        "cfgLite": {
          "bytes": 4773,
          "calls": 81,
          "ripRefs": 40,
          "resyncs": 0
        },
        "callees": [
          {
            "ordinal": 12,
            "name": "string_TidyDeallocate",
            "target": "0x52780"
          },
          {
            "ordinal": 15,
            "name": "string_Allocate",
            "target": "0x52a40"
          },
          {
            "ordinal": 24,
            "name": "string_TidyDeallocate",
            "target": "0x52780"
          },
          {
            "ordinal": 46,
            "name": "Status_ApplyByName",
            "target": "0x483120"
          },
          {
            "ordinal": 47,
            "name": "Status_ApplyByName",
            "target": "0x483120"
          },
          {
            "ordinal": 60,
            "name": "Ability_trigger",
            "target": "0x320a0"
          }
        ],
        "prologue": "48 89 5C 24 08 89 54 24 10 55 56 57"
      },
      "consumers": [
        "native/framework/src/framework.c:hook_Character_BeginTurn"
      ],
      "exposure": [
        {
          "enum": "FW_SYM_Character_BeginTurn",
          "index": 1
        }
      ],
      "evidence": [
        "docs/engine-map.md#functions-and-signatures",
        ".analysis/decompiled/Character_BeginTurn_0x10a9b0.c"
      ],
      "verify": {
        "log": "hook installed: Character::BeginTurn"
      }
    },
    {
      "name": "Ability_trigger",
      "kind": "function",
      "rva": "0x320a0",
      "signature": {
        "pattern": "48 89 54 24 10 55 53 56 57 41 54 41 55 41 56 41 57 48 8D AC 24 68 FD",
        "exactLen": 23,
        "offset": 0,
        "wildcards": []
      },
      "anchors": {
        "strings": [
          {
            "text": "C:\\Users\\Tyler\\Desktop\\SVN\\Mewgenics\\game\\code\\Ability.cpp",
            "role": "file",
            "unique": true
          },
          {
            "text": "void __cdecl glaiel::Ability::trigger(struct glaiel::TurnAction)",
            "role": "funcsig",
            "unique": true
          }
        ],
        "cfgLite": {
          "bytes": 7831,
          "calls": 186,
          "ripRefs": 62,
          "resyncs": 2
        },
        "callees": [
          {
            "ordinal": 5,
            "name": "string_TidyDeallocate",
            "target": "0x52780"
          },
          {
            "ordinal": 6,
            "name": "string_TidyDeallocate",
            "target": "0x52780"
          },
          {
            "ordinal": 19,
            "name": "string_TidyDeallocate",
            "target": "0x52780"
          },
          {
            "ordinal": 21,
            "name": "string_TidyDeallocate",
            "target": "0x52780"
          },
          {
            "ordinal": 23,
            "name": "string_TidyDeallocate",
            "target": "0x52780"
          },
          {
            "ordinal": 24,
            "name": "string_TidyDeallocate",
            "target": "0x52780"
          },
          {
            "ordinal": 25,
            "name": "string_TidyDeallocate",
            "target": "0x52780"
          },
          {
            "ordinal": 29,
            "name": "string_TidyDeallocate",
            "target": "0x52780"
          },
          {
            "ordinal": 65,
            "name": "string_TidyDeallocate",
            "target": "0x52780"
          },
          {
            "ordinal": 66,
            "name": "string_TidyDeallocate",
            "target": "0x52780"
          },
          {
            "ordinal": 80,
            "name": "string_TidyDeallocate",
            "target": "0x52780"
          },
          {
            "ordinal": 81,
            "name": "string_TidyDeallocate",
            "target": "0x52780"
          },
          {
            "ordinal": 87,
            "name": "string_TidyDeallocate",
            "target": "0x52780"
          },
          {
            "ordinal": 88,
            "name": "string_TidyDeallocate",
            "target": "0x52780"
          },
          {
            "ordinal": 96,
            "name": "string_TidyDeallocate",
            "target": "0x52780"
          },
          {
            "ordinal": 97,
            "name": "string_TidyDeallocate",
            "target": "0x52780"
          },
          {
            "ordinal": 102,
            "name": "string_Allocate",
            "target": "0x52a40"
          },
          {
            "ordinal": 104,
            "name": "string_TidyDeallocate",
            "target": "0x52780"
          },
          {
            "ordinal": 105,
            "name": "string_TidyDeallocate",
            "target": "0x52780"
          },
          {
            "ordinal": 107,
            "name": "Status_ApplyByName",
            "target": "0x483120"
          },
          {
            "ordinal": 109,
            "name": "string_Allocate",
            "target": "0x52a40"
          },
          {
            "ordinal": 111,
            "name": "Status_AttachPassive",
            "target": "0x494080"
          },
          {
            "ordinal": 139,
            "name": "string_TidyDeallocate",
            "target": "0x52780"
          },
          {
            "ordinal": 140,
            "name": "string_TidyDeallocate",
            "target": "0x52780"
          },
          {
            "ordinal": 143,
            "name": "string_Allocate",
            "target": "0x52a40"
          },
          {
            "ordinal": 146,
            "name": "string_Allocate",
            "target": "0x52a40"
          },
          {
            "ordinal": 151,
            "name": "string_Allocate",
            "target": "0x52a40"
          },
          {
            "ordinal": 155,
            "name": "string_TidyDeallocate",
            "target": "0x52780"
          },